{
  "schema_version": "1",
  "generated_at": "2026-07-31",
  "repo": "dataset-incubator",
  "topic": "pipeline_state",
  "summary": {
    "total": 109,
    "by_status": {
      "ok": 109,
      "warn": 0,
      "error": 0
    }
  },
  "signals": [
    {
      "id": "aci-prime-iscrizioni-autovetture",
      "source_id": "",
      "status": "ok",
      "label": "aci-prime-iscrizioni-autovetture",
      "detail": "anno 2024 — fonti: aci_2017, aci_2018 — mart: sì",
      "action": "",
      "latest_run": {
        "status": "passed",
        "run_id": "28817993929",
        "run_url": "https://github.com/dataciviclab/dataset-incubator/actions/runs/28817993929",
        "checked_at": "2026-07-06",
        "years": [
          2024
        ],
        "config_path": "candidates/aci-prime-iscrizioni-autovetture/dataset.yml"
      }
    },
    {
      "id": "ade-cinque-per-mille",
      "source_id": "ade",
      "status": "ok",
      "label": "ade-cinque-per-mille",
      "detail": "anni 2023-2025 — fonte: ? — mart: sì",
      "action": "",
      "latest_run": {
        "status": "passed",
        "run_id": "29826248891",
        "run_url": "https://github.com/dataciviclab/dataset-incubator/actions/runs/29826248891",
        "checked_at": "2026-07-21",
        "years": [
          2023,
          2024,
          2025
        ],
        "config_path": "candidates/ade-cinque-per-mille/dataset.yml"
      }
    },
    {
      "id": "aifa-spesa-consumo",
      "source_id": "aifa",
      "status": "ok",
      "label": "aifa-spesa-consumo",
      "detail": "anni 2018-2024 — fonte: aifa_spesa_consumo_csv — mart: sì",
      "action": "",
      "latest_run": {
        "status": "passed",
        "run_id": "30524438404",
        "run_url": "https://github.com/dataciviclab/dataset-incubator/actions/runs/30524438404",
        "checked_at": "2026-07-30",
        "duration_seconds": 10.113,
        "readiness": "needs-review",
        "readiness_checks": {
          "total": 8,
          "ok": 7,
          "fail": 1
        },
        "years": [
          2018,
          2019,
          2020,
          2021,
          2022,
          2023,
          2024
        ],
        "config_path": "candidates/aifa-spesa-consumo/dataset.yml"
      }
    },
    {
      "id": "anac-aggiudicazioni",
      "source_id": "anac",
      "status": "ok",
      "label": "anac-aggiudicazioni",
      "detail": "anno 2026 — fonte: aggiudicazioni — mart: sì",
      "action": "",
      "latest_run": {
        "status": "passed",
        "run_id": "29639215447",
        "run_url": "https://github.com/dataciviclab/dataset-incubator/actions/runs/29639215447",
        "checked_at": "2026-07-18",
        "years": [
          2026
        ],
        "config_path": "candidates/anac-aggiudicazioni/dataset.yml"
      }
    },
    {
      "id": "anac-bandi-gara",
      "source_id": "anac",
      "status": "ok",
      "label": "anac-bandi-gara",
      "detail": "anni 2016-2025 — fonte: cig_{year} — mart: sì",
      "action": "",
      "latest_run": {
        "status": "passed",
        "run_id": "28327708156",
        "run_url": "https://github.com/dataciviclab/dataset-incubator/actions/runs/28327708156",
        "checked_at": "2026-06-28",
        "years": [
          2016,
          2017,
          2018,
          2019,
          2020,
          2021,
          2022,
          2023,
          2024,
          2025
        ],
        "config_path": "candidates/anac-bandi-gara/dataset.yml"
      }
    },
    {
      "id": "anpr-mobilita-residenziale",
      "source_id": "anpr",
      "status": "ok",
      "label": "anpr-mobilita-residenziale",
      "detail": "anno 2026 — fonte: anpr_cambi_residenza_csv — mart: sì",
      "action": "",
      "latest_run": {
        "status": "passed",
        "run_id": "28370691002",
        "run_url": "https://github.com/dataciviclab/dataset-incubator/actions/runs/28370691002",
        "checked_at": "2026-06-29",
        "years": [
          2026
        ],
        "config_path": "candidates/anpr-mobilita-residenziale/dataset.yml"
      }
    },
    {
      "id": "bdap-entrate-stato",
      "source_id": "openbdap",
      "status": "ok",
      "label": "bdap-entrate-stato",
      "detail": "anno 2024 — fonte: openbdap_entrate_csv — mart: sì",
      "action": "",
      "latest_run": {
        "status": "passed",
        "run_id": "26637016060",
        "run_url": "https://github.com/dataciviclab/dataset-incubator/actions/runs/26637016060",
        "checked_at": "2026-05-29",
        "years": [
          2024
        ],
        "config_path": "candidates/bdap-entrate-stato/dataset.yml"
      }
    },
    {
      "id": "bdap-lea",
      "source_id": "openbdap",
      "status": "ok",
      "label": "bdap-lea",
      "detail": "anni 2019-2024 — fonte: bdap_lea_csv — mart: sì",
      "action": "",
      "latest_run": {
        "status": "passed",
        "run_id": "27040177316",
        "run_url": "https://github.com/dataciviclab/dataset-incubator/actions/runs/27040177316",
        "checked_at": "2026-06-05",
        "years": [
          2019,
          2020,
          2021,
          2022,
          2023,
          2024
        ],
        "config_path": "candidates/bdap-lea/dataset.yml"
      }
    },
    {
      "id": "bdap-spese-stato",
      "source_id": "openbdap",
      "status": "ok",
      "label": "bdap-spese-stato",
      "detail": "anno 2024 — fonte: openbdap_spese_csv — mart: sì",
      "action": "",
      "latest_run": {
        "status": "passed",
        "run_id": "27060712871",
        "run_url": "https://github.com/dataciviclab/dataset-incubator/actions/runs/27060712871",
        "checked_at": "2026-06-06",
        "years": [
          2024
        ],
        "config_path": "candidates/bdap-spese-stato/dataset.yml"
      }
    },
    {
      "id": "camera-deputati-legislature",
      "source_id": "dati_camera",
      "status": "ok",
      "label": "camera-deputati-legislature",
      "detail": "anno 2024 — fonte: camera_deputati_sparql — mart: sì",
      "action": "",
      "latest_run": {
        "status": "passed",
        "run_id": "26682747895",
        "run_url": "https://github.com/dataciviclab/dataset-incubator/actions/runs/26682747895",
        "checked_at": "2026-05-30",
        "years": [
          2024
        ],
        "config_path": "candidates/camera-deputati-legislature/dataset.yml"
      }
    },
    {
      "id": "camera-votazioni-sparql",
      "source_id": "dati_camera",
      "status": "ok",
      "label": "camera-votazioni-sparql",
      "detail": "anni 2018-2025 — fonte: sparql — mart: sì",
      "action": "",
      "latest_run": {
        "status": "passed",
        "run_id": "26683799852",
        "run_url": "https://github.com/dataciviclab/dataset-incubator/actions/runs/26683799852",
        "checked_at": "2026-05-30",
        "years": [
          2018,
          2019,
          2020,
          2021,
          2022,
          2023,
          2024,
          2025
        ],
        "config_path": "candidates/camera-votazioni-sparql/dataset.yml"
      }
    },
    {
      "id": "centri-accoglienza-italia",
      "source_id": "centri_d_italia",
      "status": "ok",
      "label": "centri-accoglienza-italia",
      "detail": "anno 2026 — fonte: centri-accoglienza-italia_source — mart: sì",
      "action": "",
      "latest_run": {
        "status": "passed",
        "run_id": "28542315999",
        "run_url": "https://github.com/dataciviclab/dataset-incubator/actions/runs/28542315999",
        "checked_at": "2026-07-01",
        "years": [
          2026
        ],
        "config_path": "candidates/centri-accoglienza-italia/dataset.yml"
      }
    },
    {
      "id": "civile-flussi",
      "source_id": "giustizia_statistiche",
      "status": "ok",
      "label": "civile-flussi",
      "detail": "anno 2025 — fonte: ministero_giustizia_xlsx — mart: sì",
      "action": "",
      "latest_run": {
        "status": "passed",
        "run_id": "26036106012",
        "run_url": "https://github.com/dataciviclab/dataset-incubator/actions/runs/26036106012",
        "checked_at": "2026-05-18",
        "years": [
          2025
        ],
        "config_path": "candidates/civile-flussi/dataset.yml"
      }
    },
    {
      "id": "consip-consumi-convenzione",
      "source_id": "consip_open_data",
      "status": "ok",
      "label": "consip-consumi-convenzione",
      "detail": "anni 2023-2025 — fonti: consip_consumi_convenzione_2023, consip_consumi_convenzione_2024 — mart: sì",
      "action": "",
      "latest_run": {
        "status": "passed",
        "run_id": "26456578571",
        "run_url": "https://github.com/dataciviclab/dataset-incubator/actions/runs/26456578571",
        "checked_at": "2026-05-26",
        "years": [
          2023,
          2024,
          2025
        ],
        "config_path": "candidates/consip-consumi-convenzione/dataset.yml"
      }
    },
    {
      "id": "dait-amministratori-locali",
      "source_id": "dait",
      "status": "ok",
      "label": "dait-amministratori-locali",
      "detail": "anno 2026 — fonte: dait_ammcom — mart: sì",
      "action": "",
      "latest_run": {
        "status": "passed",
        "run_id": "27638710012",
        "run_url": "https://github.com/dataciviclab/dataset-incubator/actions/runs/27638710012",
        "checked_at": "2026-06-16",
        "years": [
          2026
        ],
        "config_path": "candidates/dait-amministratori-locali/dataset.yml"
      }
    },
    {
      "id": "dipendenti-pubblici",
      "source_id": "openbdap",
      "status": "ok",
      "label": "dipendenti-pubblici",
      "detail": "anni 2010-2024 — fonte: bdap_csv — mart: sì",
      "action": "",
      "latest_run": {
        "status": "passed",
        "run_id": "29419456370",
        "run_url": "https://github.com/dataciviclab/dataset-incubator/actions/runs/29419456370",
        "checked_at": "2026-07-15",
        "years": [
          2010,